{
  "contract_version": "1.0", "design_id": "SD-TELEMETRY-INGEST", "mode": "production", "status": "in_progress",
  "problem": {"summary": "High-volume device telemetry ingestion", "scope": "ingest, buffer, process, retain", "actors": ["devices", "analysts"], "source": "fixture", "confidence": "high"},
  "functional_requirements": [{"id": "FR-001", "statement": "Accept telemetry batches", "status": "accepted", "source": "fixture", "confidence": "high"}, {"id": "FR-002", "statement": "Query recent telemetry", "status": "accepted", "source": "fixture", "confidence": "high"}],
  "non_functional_requirements": [{"id": "NFR-001", "statement": "Sustain 100000 events/s peak", "metric": "events_per_second", "target": 100000, "status": "accepted", "source": "fixture", "confidence": "medium"}],
  "constraints": ["bursty traffic", "90 day hot retention"], "out_of_scope": ["real-time control commands"],
  "assumptions": [{"id": "ASM-001", "statement": "Events are independently processable", "status": "provisional", "source": "fixture", "confidence": "medium"}],
  "estimates": [], "architecture": {}, "interfaces": [], "data_topology": {}, "decisions": [], "failure_modes": [], "validation_findings": [], "open_questions": [], "traceability": []
}
