{
  "contract_version": "1.0",
  "design_id": "SD-URL-HIGH-READ",
  "mode": "production",
  "status": "in_progress",
  "problem": {
    "summary": "Global URL redirect service",
    "scope": "redirect and create APIs",
    "actors": [
      "clients",
      "operators"
    ],
    "source": "fixture",
    "confidence": "high"
  },
  "functional_requirements": [
    {
      "id": "FR-001",
      "statement": "Create short URLs",
      "status": "accepted",
      "source": "fixture",
      "confidence": "high"
    },
    {
      "id": "FR-002",
      "statement": "Redirect short URLs",
      "status": "accepted",
      "source": "fixture",
      "confidence": "high"
    }
  ],
  "non_functional_requirements": [
    {
      "id": "NFR-001",
      "statement": "Redirect p99 under 100 ms",
      "metric": "p99_latency_ms",
      "target": 100,
      "status": "accepted",
      "source": "fixture",
      "confidence": "medium",
      "unit": "ms",
      "window": "rolling 5 minutes"
    }
  ],
  "constraints": [
    "read-heavy",
    "large public audience"
  ],
  "out_of_scope": [
    "custom analytics"
  ],
  "assumptions": [
    {
      "id": "ASM-001",
      "statement": "Read/write ratio is 100:1",
      "status": "provisional",
      "source": "fixture",
      "confidence": "medium"
    }
  ],
  "estimates": [],
  "architecture": {},
  "interfaces": [],
  "data_topology": {},
  "decisions": [],
  "failure_modes": [],
  "validation_findings": [],
  "open_questions": [],
  "traceability": []
}
