{
  "contract_version": "1.0",
  "design_id": "SD-LOW-TRAFFIC",
  "mode": "production",
  "status": "in_progress",
  "problem": {
    "summary": "Internal order tracking",
    "scope": "web application",
    "actors": [
      "staff"
    ],
    "source": "fixture",
    "confidence": "high"
  },
  "functional_requirements": [
    {
      "id": "FR-001",
      "statement": "Staff can create and view orders",
      "status": "accepted",
      "source": "fixture",
      "confidence": "high"
    }
  ],
  "non_functional_requirements": [
    {
      "id": "NFR-001",
      "statement": "p95 read latency under 300 ms at 20 req/s",
      "status": "accepted",
      "source": "fixture",
      "confidence": "high",
      "metric": "p95_read_latency",
      "target": 300,
      "unit": "ms",
      "window": "rolling 5 minutes at 20 req/s"
    }
  ],
  "constraints": [
    "small team",
    "single region"
  ],
  "out_of_scope": [
    "global active-active"
  ],
  "assumptions": [
    {
      "id": "ASM-001",
      "statement": "Peak traffic is 20 req/s",
      "status": "provisional",
      "source": "fixture",
      "confidence": "medium"
    }
  ],
  "estimates": [],
  "architecture": {},
  "interfaces": [],
  "data_topology": {},
  "decisions": [],
  "failure_modes": [],
  "validation_findings": [],
  "open_questions": [],
  "traceability": []
}
